{
  "$schema": "https://json-schema.org/draft/2020-12/schema",
  "$id": "storymaker/proyecto@1",
  "title": "Cabecera del Proyecto",
  "description": "Un Proyecto es un directorio autocontenido y portatil: copiarlo lo lleva entero, con su bitacora y su auditoria. Queda anclado para toda su vida a la version del arnes y del esquema con que se creo: si la definicion del arnes avanza, los Proyectos abiertos siguen corriendo con la anterior (ADR-015). No hay migracion en caliente.",
  "type": "object",
  "required": ["esquema", "id", "titulo_provisional", "creado_en", "version_arnes", "version_esquema", "version_configuracion", "estado_etapa", "estado_proyecto"],
  "properties": {
    "esquema": { "const": "proyecto@1" },
    "id": { "type": "string", "pattern": "^PRY-[0-9]{8}-[a-z0-9-]+$", "description": "PRY-<aaaammdd>-<slug>. Estable, nunca se reutiliza." },
    "titulo_provisional": { "type": "string" },
    "creado_en": { "type": "string", "format": "date-time" },
    "version_arnes": { "type": "string" },
    "version_esquema": { "type": "string" },
    "version_configuracion": { "type": "string", "description": "Se anota para que dos informes sean comparables (R-23)." },
    "version_cliches": { "type": "string" },
    "estado_etapa": {
      "type": "object",
      "additionalProperties": { "enum": ["No_iniciada", "En_curso", "Cerrada", "Cerrada_incompleta", "Congelada", "Bloqueada", "Abortada"] }
    },
    "estado_proyecto": { "enum": ["Creado", "En_ejecucion", "Bloqueado", "Entregado", "Abortado"] },
    "solo_lectura": { "type": "boolean", "description": "Un Proyecto cuyo esquema es anterior a la version mayor vigente pasa a solo lectura: sigue siendo legible y auditable para siempre, pero no admite pasos nuevos." }
  },
  "invariante": "Un Proyecto tiene exactamente un Encargo y, como maximo, un Contexto Historico sellado, un Canon congelado y un Manuscrito VIGENTES. Los sustituidos por una repeticion de etapa pasan a archivo/ y dejan de ser vigentes (RF-066): se archiva, no se borra."
}
