{
  "esquema": "proyecto@1",
  "id": "PRY-20260918-el-asedio-de-zamora",
  "titulo_provisional": "El asedio de Zamora",
  "creado_en": "2026-09-18T11:53:24Z",
  "version_arnes": "1.0.0",
  "version_esquema": "proyecto@1",
  "version_configuracion": "1.0.0",
  "version_cliches": "1.0.0",
  "estado_etapa": {
    "etapa-0": "Congelada",
    "etapa-1": "Cerrada_incompleta",
    "etapa-2": "Congelada",
    "etapa-3": "Cerrada"
  },
  "estado_proyecto": "Entregado",
  "solo_lectura": true
}